{
  "$schema": "https://json-schema.org/draft/2020-12/schema",
  "$id": "https://rasq.io/schema/bundle-0.1.json",
  "title": "RASQ package descriptor (bundle.json, rasq.bundle/1 — D-244)",
  "description": ".rasqpkg(D-034: zstd 圧縮 tar)の先頭に置く目次。root(この配布物の主プラグイン)と、その配下にバンドルされる子プラグイン / wasm 化ライブラリ / アセット / モデルを列挙し、ホストはこれを見て wasm.call の親子関係(構成許可)と展開先を決める。ハッシュはすべて配布物内のファイルに対する SHA-512(hex)。CLI(docs/cli.md)が `rasq build` で生成し、手書きしない。",
  "type": "object",
  "required": ["schema", "root", "children", "libs", "assets", "models"],
  "allOf": [
    {
      "$comment": "アセットパック(root.kind = assets、契約 v0.11): wasm / children / libs / models 無し、assets は画像だけ(sha512 / sizeBytes 必須)。それ以外の root は wasm が要る。",
      "if": { "properties": { "root": { "properties": { "kind": { "const": "assets" } }, "required": ["kind"] } } },
      "then": { "properties": { "root": { "not": { "required": ["wasm"] } }, "children": { "maxItems": 0 }, "libs": { "maxItems": 0 }, "models": { "maxItems": 0 }, "assets": { "minItems": 1, "items": { "properties": { "kind": { "const": "image" } }, "required": ["path", "kind", "sha512", "sizeBytes"] } } } },
      "else": { "properties": { "root": { "required": ["wasm"] } } }
    }
  ],
  "additionalProperties": false,
  "properties": {
    "schema": { "const": "rasq.bundle/1" },
    "$comment": { "type": "string" },
    "sdk": { "type": "string", "description": "生成した CLI の版(SemVer)。互換性の目安、検証には使わない" },
    "createdAt": { "type": "string", "format": "date-time" },
    "root": {
      "type": "object",
      "required": ["id", "version", "kind", "manifest"],
      "additionalProperties": false,
      "description": "この配布物の主プラグイン。ストアの掲載 id = root.id、版 = root.version(Central の publish_version はマニフェストの id/version と突き合わせる)",
      "properties": {
        "id": { "$ref": "action-ref.schema.json#/$defs/pluginId" },
        "version": { "$ref": "action-ref.schema.json#/$defs/pluginVersion" },
        "kind": { "$ref": "slot-registry.schema.json#/$defs/kind" },
        "manifest": { "$ref": "#/$defs/path", "description": "manifest.schema.json に合う JSON(SNS プラグインは function.json、スロットプラグインは plugin.manifest の答えと同じもの)" },
        "wasm": { "$ref": "#/$defs/file" },
        "safety": {
          "type": "object",
          "additionalProperties": false,
          "description": "掲載の安全性ブロック(store.yaml SafetyBlock の申告部分)。rasq.toml の [listing.safety] から rasq build が入れる。Central はどの経路で受け取っても掲載に反映し、審査 (rasq-judge) は宣言した権限すべてに理由があるかを見る。目次の中に置くのは、別ファイルにすると目次に無いファイルを拒否する既存の検査を壊すため",
          "properties": {
            "permissions": { "type": "array", "items": { "type": "object", "required": ["permission", "reason"], "additionalProperties": false, "properties": { "permission": { "type": "string" }, "reason": { "type": "string" } } } },
            "externalHosts": { "type": "array", "items": { "type": "string" } },
            "dataHandling": { "type": "string" }
          }
        },
        "requires": {
          "type": "array",
          "description": "土台として読み込んだ SNS プラグインが他人のもの(自分の配布物に含めない)なら、ここで依存として宣言する。ホストは同じ id のプラグインが入っていなければインストールを止める(permissionDenied ではなく unsupported)",
          "items": {
            "type": "object",
            "required": ["id", "version"],
            "additionalProperties": false,
            "properties": {
              "id": { "$ref": "action-ref.schema.json#/$defs/pluginId" },
              "version": { "type": "string", "description": "SemVer の範囲(Cargo と同じ書き方: '^0.1', '>=0.1.0, <0.3')" }
            }
          }
        }
      }
    },
    "children": {
      "type": "array",
      "description": "root の配下にバンドルされる子プラグイン。id は root.id + '.' で始まること(validate.py が確かめる)。root は wasm.call({plugin: <child id>, fn, args}) で子を呼べ、子は root を呼べない(一方向)。子は自分のスロットを持ち、ホストは root と一緒に登録する",
      "items": {
        "type": "object",
        "required": ["id", "version", "kind", "manifest", "wasm"],
        "additionalProperties": false,
        "properties": {
          "id": { "$ref": "action-ref.schema.json#/$defs/pluginId" },
          "version": { "$ref": "action-ref.schema.json#/$defs/pluginVersion" },
          "kind": { "$ref": "slot-registry.schema.json#/$defs/kind" },
          "manifest": { "$ref": "#/$defs/path" },
          "wasm": { "$ref": "#/$defs/file" },
          "template": { "type": "string", "description": "雛形の名前(rasq new <slot> の <slot>)。記録用" }
        }
      }
    },
    "libs": {
      "type": "array",
      "description": "wasm 化した既存ライブラリ(画面を持たない wasm モジュール)。root / children から wasm.call({lib: <name>, fn, args}) で呼ぶ。exports に無い fn は C01",
      "items": {
        "type": "object",
        "required": ["name", "wasm", "exports"],
        "additionalProperties": false,
        "properties": {
          "name": { "type": "string", "pattern": "^[a-z][a-z0-9_-]*$" },
          "wasm": { "$ref": "#/$defs/file" },
          "exports": { "type": "array", "minItems": 1, "items": { "$ref": "slot-registry.schema.json#/$defs/fnName" } },
          "source": { "type": "string", "description": "元のクレートや URL(記録用)" },
          "license": { "type": "string" }
        }
      }
    },
    "assets": {
      "type": "array",
      "description": "添付ファイル。プラグインからは storage.get({ns: 'asset', key: <path>}) で読む(第一期はホスト側の配線待ち、docs/cli.md §7)",
      "items": {
        "type": "object",
        "required": ["path", "kind"],
        "additionalProperties": false,
        "properties": {
          "path": { "$ref": "#/$defs/path" },
          "kind": { "enum": ["rrl", "rsl", "image", "audio", "data"] },
          "sha512": { "$ref": "#/$defs/sha512" },
          "sizeBytes": { "type": "integer", "minimum": 0 }
        }
      }
    },
    "models": {
      "type": "array",
      "description": "ML モデル。manifest は model-manifest.schema.json に合うファイルで、その artifacts.*.sha512 が実ファイルと一致すること(D-034)。lazy なら .rasqpkg には manifest だけ入れ、本体はストアの別 artifact(kind=model)",
      "items": {
        "type": "object",
        "required": ["manifest", "lazy"],
        "additionalProperties": false,
        "properties": {
          "manifest": { "$ref": "#/$defs/path" },
          "lazy": { "type": "boolean" },
          "artifactId": { "type": "string", "pattern": "^[A-Za-z0-9_-]{1,64}$", "description": "lazy のときのストア側 artifactId(Central の upload_artifact と同じ制約)" }
        }
      }
    }
  },
  "$defs": {
    "path": { "type": "string", "pattern": "^[A-Za-z0-9_][A-Za-z0-9_./-]*$", "description": "配布物内の相対パス。'..' や先頭 '/' は不可" },
    "sha512": { "type": "string", "pattern": "^[0-9a-f]{128}$" },
    "file": {
      "type": "object",
      "required": ["path", "sha512", "sizeBytes"],
      "additionalProperties": false,
      "properties": {
        "path": { "$ref": "#/$defs/path" },
        "sha512": { "$ref": "#/$defs/sha512" },
        "sizeBytes": { "type": "integer", "minimum": 1 }
      }
    }
  }
}
